,sample,imitator,type
424,woke up this morning with a terrible sore throat. went to doctor and it is streph throat. doctor said not to be around anyone but i will come in anyway...important meeting. ,imitator21,tweet
425,"tom hanks....you can play any character with such believeability (new word). funny, crazy, serious. your face speaks even before you open your mouth. that is talent. ",imitator21,tweet
426,summer...time to break out the bathing suits and suntan lotion. love the beach. warm sand between the toes and the foam of the waves from the ocean. ,imitator21,tweet
427,what a thoughtful gift you have given me. it was a total surprise and i will think of you each time i use it. thank you so much!,imitator21,tweet
428,went to see gone with the wind. very long but so sweeping that it pulls you right in and so haunting long after it ends. ,imitator21,tweet
429,i hate to do this at the last minute but i just got a call from my boss and he needs me to finish up a report tonight that was not due until next wednesday. ,imitator21,tweet
430,I received your gift today and really you shouldn't have. It wasn't even my birthday! You are so sweet to remember how much I liked the sweater you wore to buy me the same one ,imitator21,tweet
431,This year for my birthday I would like us to go out to the new restaurant down the street and try something we've never eaten before. Then go shopping for something we can't afford. ,imitator21,tweet
432,"Dear mom and dad....as if you being my parents wasn't enough of a gift, you are now helping me with my college fund. I did not expect this but you are the greatest. ",imitator21,tweet
433,You won't believe what happened on the way to the office. I am stuck in the elevator and am waiting for the repair crew to come to the rescue. ,imitator21,tweet
434,I have to cancel our outing tomorrow because I have to take my dog to the vet. He has a bad cough and his nose is running. ,imitator21,tweet
435,Thank you thank you thank you. You are the best friend ever. How did  you know i needed a new coffee maker....Let's go try it out. ,imitator21,tweet
436,I apologize for being late to the meeting.. I forgot to turn my clock ahead so I am an hour behind. Next year I put a reminder on my phone. ,imitator21,tweet
437,I can't believe this....I bought you a present for no reason and you bought me a present for no reason...we must really be best friends cause we think alike. ,imitator21,tweet
438,What a surprise. I have been wanting a new watch for the longest time and here you go and buy me one. Thank you. Let me take you to lunch...my treat. ,imitator21,tweet
439,A lot of people don't like fall but I do. I actually love raking leaves. I love the smell of fireplaces and the colorful gourds and pumpkins and apples. ,imitator21,tweet
440,You are the bestest friend a person could have. How thoughtful of you to get me this gift. I really needed a pick me up. ,imitator21,tweet
441,spring is my favorite season. this is the time i start planning my garden and flowers. i hope this year the squirrels don't get to my tomatoes before they ripen. ,imitator21,tweet
442,I have the greatest parents. Your support means the world to me. I could not have gotten through this situation without you. ,imitator21,tweet
443,Summertime is here....get out the canoe and lets go paddle down the creek we went to last year. it is so peaceful...we can pack a lunch basket. ,imitator21,tweet
444,I just got a call from my sister.  she needs me to babysit for her. I wouldn't normally cancel our plans but this is important. ,imitator21,tweet
445,I lost my pocketbook. Misplaced my phone. Broke the heel on my favorite shoes. And burnt my toast. And I just got fired. What a great day. ,imitator21,tweet
446,The delivery man just brought a beautiful bouquet of flowers to my door. How did you know I liked sunflowers...so pretty. thank you. ,imitator21,tweet
447,I am so glad winter snow is here. I just got a new sled I am dying to try out. Going up the hill by Pedmont Street and sliding down...just like a little kid. ,imitator21,tweet
448,"Dear parents, I just want to thank you for the birthday party you threw me. Totally unexpected. So good to see family gathered. ",imitator21,tweet
449,You have to see this movie. It has all the elements you want to see. It is the kind of movie that you have to see several times to catch it all. ,imitator21,tweet
450,I am so happy you received the acknowledgement for all your hard work. You are way past due for it and no one deserves it more. ,imitator21,tweet
451,That gift you gave me? Could not have come at a better time. My car broke down so that certificate will really come in handy. You are the best. ,imitator21,tweet
452,So I am planning to move to Ireland in five years. I visited there two years ago and decided that is where I want to be. ,imitator21,tweet
453,I have proven myself a valuable employee with great ideas that have brought the company more clients and feel I deserve a raise. ,imitator21,tweet
454,I have been here for over 3 years and was supposed to get a raise after the first year. I have not. Can I have mine now? ,imitator21,tweet
455,My parents......where would i be without you. Well I would be walking if you hadn't bought me a new car! Love ya. Lets go for a ride. ,imitator21,tweet
456,We haven't been away together for so long. I think we should look at some travel brochures and plan a nice getaway. We deserve it. ,imitator21,tweet
457,So you graduated college! It was a tough road and I know you wanted to quit but aren't you glad you didn't . I am so proud of you. ,imitator21,tweet
458,Ohh. I think I have food poisoning. I went out to lunch today and had spinach salad. I have been sick all afternoon. I need to cancel. ,imitator21,tweet
459,Recently visited key west. so quaint i did not want to leave. they are so laid back and everyone smells like coconut. Yum. ,imitator21,tweet
460,My dad needs me to drive him to his doctors appointment. He can't see clearly. He can't reschedule. So i need to cancel our plans. ,imitator21,tweet
461,I had to put my dog down today. Lost my best friend. Thought he was getting better but I was wrong. I miss him so much. ,imitator21,tweet
462,"Don't you just love spring. I am going to get a whole new wardrobe of pastels to match the mood I am in. Springy. Pink, yellow, baby blue....",imitator21,tweet
463,I knew you would get elected president. Everyone knew you are the best person for the job. You are going to do great. Congrats. ,imitator21,tweet
464,"I suggest we get in the car, start driving in a direction we've never taken and see where we land up. a mini unplanned vacation. ",imitator21,tweet
465,"Joe, let's go to Hawaii. They have great deals right now. We could do Honolulu, Maui and Kaui. What do you think? Good?",imitator22,tweet
466,"Kathy, spring is almost here and I can't wait to get out and do some gardening. I bought a garden tiller this year.",imitator22,tweet
467,"So, I've always wanted a garden tiller. I found a great one and am going to ask for it as a birthday present.",imitator22,tweet
468,My father-in-law was just admitted to the hospital. I am going to have to cancel our plans for tonight. I'll call you.,imitator22,tweet
469,In 5 years I'll be ready for a European vacation! I'm working on big home remodel jobs for a while and saving $.,imitator22,tweet
470,I had the best time in the area of Little Italy while visiting my friend. What a great culture - and food!,imitator22,tweet
471,I've now been here for 5 years and have proven my skills. I feel I am ready to receive a raise of 8%.,imitator22,tweet
472,It has been 2 years since my last raise. I have a good work ethic and am requesting a 5% raise for my work.,imitator22,tweet
473,"Susie, congratulations on your new job! You are going to fit right in over there. They are lucky to have you.",imitator22,tweet
474,While in San Diego we visited a great Asian segment of the city. I learned so much and enjoyed really great food.,imitator22,tweet
475,I see that Cancun has some really great deals on 10-day vacation packages. They are all inclusive. Let's go!,imitator22,tweet
476,"Judy, thank you so much for the terrific birthday present. You know I am going to use this every day. Thanks!",imitator22,tweet
477,"Michael, your latest book was a real page turner. I loved your new characters and hope to see more books like this in the future.",imitator22,tweet
478,"Mitchell, I just finished readying your series on Court. What great books! I'm looking forward to the next one!",imitator22,tweet
479,Woot! Summer is my favorite time of the year. Flowers are growing and my vegetable garden is doing great this year.,imitator22,tweet
480,We had an agreement that we would talk about a raise at this time. I believe I have performed well and helped the company a great deal and deserve a raise.,imitator22,tweet
481,"Mom and Dad, thank you for coming to visit us this last week. The kids really enjoyed being around their grandparents. What a fun week we had!",imitator22,tweet
482,"The air is warming up - that means it's spring, my favorite time of the year. Let's get together for our morning walks.",imitator22,tweet
483,"I have my eye on a new pair of sneakers for my birthday. Since you asked, I'll email you a link with color and size. Thanks!",imitator22,tweet
484,Oh wow! Thank you so much for the birthday present. I've been wearing them every day and get compliments on them all the time.,imitator22,tweet
485,I have to cancel our plans for tomorrow. My parents just called and are arriving tomorrow instead of this weekend.,imitator22,tweet
486,I'll be doing some regular volunteer work at Helping Hands. Looking forward to working with all of the underprivileged children.,imitator22,tweet
487,"Suze, I just tested positive for strip throat so have to cancel our plans for tomorrow. I'll call you next week to reschedule. Sorry!",imitator22,tweet
488,The sneakers are just perfect and so very comfortable. Thank you for picking out just what I wanted. Let's start walking in the mornings.,imitator22,tweet
489,"Jumanji, the newest version, is just great. It is funny and serious and so worth seeing. I plan to go see it again.",imitator22,tweet
490,Whew! Today was filled with meetings and organizing meetings for others in our office. I'm glad this day is over.,imitator22,tweet
491,I'd like to talk about a raise now. I am settled in and doing great work for the company. How does a 5% salary increase sound?,imitator22,tweet
492,This book you gave me for my birthday is a real page turner. Let's get together as soon as I finish it and talk about it.,imitator22,tweet
493,"Duke, did you see the great deals on a 10 day European vacation? Here's the link .... check it out. I say we make plans.",imitator22,tweet
494,"Mom and Dad, thanks for the sweet Christmas present. The coat fits perfectly and I will get tons of use out of it this winter.",imitator22,tweet
495,The cruise lines are having some sweet deals right now. We've always wanted to do that Alaskan cruise. Let's get started on our plans.,imitator22,tweet
496,I'm really going to love retirement. I have some fun projects planned around the house and a couple of vacation spots in mind.,imitator22,tweet
497,The flowers are growing and the veggies are starting to pop up. I love spring and all the new growth it brings.,imitator22,tweet
498,Our network went down at work today and we only ad our cell phones to make calls and try to get things done. It was so hectic.,imitator22,tweet
499,"You asked for birthday suggestions, so here goes ... here are a couple of links of tings I've been wanting to get. Holler!",imitator22,tweet
500,"Mary, best of luck in your new job. What a great accomplishment. Let's have lunch in a couple of weeks after you get settled.",imitator22,tweet
501,I got caught on a phone conference with a couple of our members. It's going to make me a little late to the 2 pm meeting.,imitator22,tweet
502,"Doug, it's time for my annual review. Let's schedule that for next week. In the meantime, please think about giving me a 5% raise.",imitator22,tweet
503,"Lynn, congratulations on winning the Woman of the Year Award! You so deserve that for all of the hard work you do.",imitator22,tweet
504,"In 5 years, I'll be traveling to see my kids and grandkids more often. I'm retiring soon and can't wait for more free time.",imitator22,tweet
505,I had to call both a plumber and electrician today. The bathroom drains are plugged up and two outlets shorted out.,imitator22,tweet
506,"Kathy, I am wondering if I've offended you. Each time we make plans, you cancel at the last minute. Can we talk?",imitator22,tweet
507,My plans are to make manager within 2 years and 3 years after that I want to make the head of the department.,imitator22,tweet
508,"Carla, congratulations on your promotion! You will be great in that position. I can't wait to see the heights you bring that team up to.",imitator22,tweet
509,I'm getting married in 2 years! I want to work and save some money so that we can start a family within 3 years after our marriage.,imitator22,tweet
510,Let's go to New York City this spring. I found a great package deal that includes a night at the theater and some great restaurants.,imitator22,tweet
511,"Susie, I feel that you are sending work my way that isn't in my job description. I don't mind helping but it is getting out of control.",imitator22,tweet
512,I watched It's a Wonderful Life again this season. I love the part when George enters the picture. He is hysterical.,imitator22,tweet
513,We're planning a huge European vacation. We're saving money and planning a 2 month long vacation in 5 years.,imitator22,tweet
514,The new picture you bought me looks stunning in my entry way. Thank you so much for knowing exactly what I would like.,imitator22,tweet
515,Girl. Pls send help. I can't handle it's only Monday. My first 2 houses were awffuulll. Then the snow on the drive. pls. help. ,imitator23,tweet
516,"The Hubby decided to not follow the recipe and not cook the chicken long enough. So instead of our date night, I have a date with the toilet. ",imitator23,tweet
517,My amazeballs momsters and dad helped me out today with my pupper. He was scared of the storm and she suggested I put on classical music. ,imitator23,tweet
518,"Hey Ashton Kutcher, you make me laugh my pants of. I've had the privilege of showing all your stuff to my husband for the first time! ",imitator23,tweet
519,Steven King makes me have the jitters but I can never stop turning the page! Keep on making me read at the edge of my seat. ,imitator23,tweet
520,"Sorry boss lady, I'm going to be late. Not because of anything I can't change, I just forgot to set my alarm. #don'tfireme ",imitator23,tweet
521,"My work wife nailed her interview today! Sweet sweet promotion here she comes! It's about time, she needs to be recognized for her hard work!",imitator23,tweet
522,"Hey worlds best mom, thanks for helping me pick out the flowers for my window box. Gives it that \",imitator23,tweet
523,@bosslady I'm so desperate for more money I'm willing to beg on social media. Give me more money please. #dollardollarbills,imitator23,tweet
524,Let's go to Europe. Asia and America got boring. I wanna pretend to be a gladiator at the Colosseum. And chase pigeons in that one famous place.  ,imitator23,tweet
525,You know I love you but you gotta stop.Please. stop. chewing. like. a. damn. cow. Ihateyousomuch. #closeyourmouth#ihateyou#wecantbefriends ,imitator23,tweet
526,"@bosslady, gonna be late. Locked my keys in the car, with my ignition on, because I'm amazing like that. I'll be in once I can jimmy into my car. ",imitator23,tweet
527,My daddy is amazing. Got snowed in today. He woke up an hour earlier than he needed to to drive over and spend that hour shoveling me out. ,imitator23,tweet
528,"Bob Ross. You inspire me with those trees. Every tree needs a friend, just like me. We all need a little happiness and hope. ",imitator23,tweet
529,pay check to pay check is not working out for me anymore. I'm going to need a raise boss! #moremoneyplease #iliveinafreakinbox,imitator23,tweet
530,sorry no sushi tonight best friend. I have no money because I suck at budgeting and can't handle myself in a target. Sorry. ,imitator23,tweet
531,"Tokyo is the weirdest city I've ever been to in my life. You have super old school folks who are crazy traditional, but if you follow them they're buying panties out of vendys.",imitator23,tweet
532,I'm a bad ass worker who deserves bad ass pay checks. So how about you as a bad ass boss give me a bad ass raise so I can keep being bad ass. ,imitator23,tweet
533,How on Earth are there six more days in the week? How is it only Sunday night? I can't believe how awful today is! Rufus even shit on my floor. ,imitator23,tweet
534,"Baby, we gotta get out of this snow. Lets go down to florida. I wanna see Mickey and sit on the beach with a fancy adult beverage. ",imitator23,tweet
535,J.K. Rowling you make the magic come true. I can't believe your magical world has been in my life for so long! Truly shaped me as a young adult. ,imitator23,tweet
536,Girl. you. like. say. like. to. like. too. much. it's. like. really. distracting. and like. no one understands you. because like. we count the likes. ,imitator23,tweet
537,"Will Smith bro, you were the bomb. But please stop trying to get your kid in movies. He's. a. crap. actor. Please stop. ",imitator23,tweet
538,I love winter. But come on it's April! APRIL! How can you be happy about 24 extra inches of snow! Please stop enjoying my misery.  ,imitator23,tweet
539,Sorry I won't be coming to the meeting by 4. My kid decided to miss the bus so I have to go pick her up! #singlemom #taxi,imitator23,tweet
540,In five years I hopefully won't be working pay check to pay check filling out pointless online surveys for a few extra cents. ,imitator23,tweet
541,My biffle and his wife were so sweet they secretly mailed me birthday presents all the way from Japan! #biffle #giraffe ,imitator23,tweet
542,I could come up with an excuse but really I just want to binge watch that 70's show in bed with icecream. Sorry not sorry. ,imitator23,tweet
543,"Jackie, why are you a mouth breather? You snore and I can't handle it! I can't sleep over anymore.  You literally shake me awake every night. ",imitator23,tweet
544,"Congratulations Jeremy and Nicole! 9 years of dating, high school sweet hearts, and you finally tied the knot tonight! #truelove",imitator23,tweet
545,Kim Juncook you delicious korean man. Embrace me in your thick biceps with your beautiful soulful voice singing me sweet nothings. ,imitator23,tweet
546,Fall is where it's at homeboy. The sight of dying trees is the most beautiful things a person can ever see. Fight me if you think I'm wrong. ,imitator23,tweet
547,"Please buy me a plane ticket to Osaka. I need to see Kyoto again and again, and you can come with of course! We can see pretty geishas. ",imitator23,tweet
548,"Let's get out of the heat and head up to Canada for some camping, moose, syrup, Tim Hortons and some sweet sweet ice hockey. ",imitator23,tweet
549,My mom and dad dropped of our sweet wedding gift tonight. A beautiful TV - that we needed a stand for. #elopeornope #notsorry #woulddoitagain ,imitator23,tweet
550,"You won't understand Texas, the lone star state, until you've witnessed the glory that is Nacadouches Ihop at 2am. It's amazing. ",imitator23,tweet
551,Honeymoon plans! Let's go to Vegas. That way we can elope the right way! We can stay at the Flamingo and eat so much food at the Buffets. ,imitator23,tweet
552,Something so weird about a 711 that doesn't have slurpies but instead sells curry onigiri and corn dogs as \,imitator23,tweet
553,Thanks mom and dad for taking the twins tonight! We are getting some much needed adult time. #inbedby8 #8hoursofsleep #adulting,imitator23,tweet
554,"As we are driving through Milwaukee, my very korean husband goes: \",imitator23,tweet
555,To the beautiful wife of mine. I am done shoveling shit ass snow. We are like a 90's commercial because: WE'RE GOING TO DISNEY!,imitator23,tweet
556,Jensen Ackles you are the most beautiful and sincere person on this planet. Please gaze deeply into my soul and make me weep. ,imitator23,tweet
557,"Snorin' finally passed the state bar! Watch out Illinois, there is a new bad ass Lawyer out there. Doing all the Lawyer like things. ",imitator23,tweet
558,In five years I'll be popping out baby number 2 wondering where my life has gone. Please please please future me time travel and tell me not to. ,imitator23,tweet
559,You know what I hate? When people clip their nails in public. You disgust me. I see that clipping flying across the bus. ,imitator23,tweet
560,Dropped a tire on my foot this morning. I have to wear a moon boot for a few weeks. Too humiliated to leave the house. Sorry. ,imitator23,tweet
561,"Heyyyy look at this awesome gift I got! It's from, you guessed it, the most amazing best friend anyone could ever have. ",imitator23,tweet
562,Took a wrong turn. Ended up in Narnia. Gotta find the wardrobe entrance. I should be about 15 minutes late to the meeting. Please disregard the coffee I'll be carrying. ,imitator23,tweet
563,"Let's run away to a magical land known as disney land. You, me, a plane ride and a crappy hotel? 12 hours and we could be on magic mountain. ",imitator23,tweet
564,It's my golden birthday this year. So I'm gonna need everything golden. Not actual gold. Just go spend 70 cents on a spray paint. ,imitator23,tweet
565,Men of Honor is amazing! It is powerful and inspiring based on a real life hero. I can't imagine dealing with that.,imitator24,tweet
566,I want to thank my parents for raising me right & giving me the freedom I wanted and the structure I needed to succeed.,imitator24,tweet
567,"Shout out to my boy Jay for coming through with a bottle for my house warming, since I'm too poor to buy this on my own.",imitator24,tweet
568,Sorry I had to bail. The baby was extra irritable today and she wasn't allowing me to do anything. I don't know why.,imitator24,tweet
569,I hate to be a pain but you picking your nose is gross. I don't know how you can do that in front of everyone.,imitator24,tweet
570,Didn't your parents teach you any manners? You look like a cow chewing cud! Close your mouth when you're eating.,imitator24,tweet
571,"Hey babe, I was thinking we go to an island for vacation this year. No kids, just you and me. How does Bermuda sound?",imitator24,tweet
572,"You have to go see Black Panther! It's action packed, and somehow inspirational.  There's a lot of underlying messages.",imitator24,tweet
573,Kurt Vonnegut's an absolute genius. He's able to convey exactly how I feel about society today without expressly saying.,imitator24,tweet
574,"Hey, Sorry for cancelling tonight. I feel awful and I'm nauseous. I think I might have food poisoning from lunch.",imitator24,tweet
575,"Batman is the best movie of all time. Visually stunning, has underlying messages and do I need to mention the action?",imitator24,tweet
576,I've been working here for 3 years and I think the value that I bring to the company is more than what I'm being paid.,imitator24,tweet
577,"Summer is by far the best season. Popup beer gardens, long days, great weather. How can any other season compete?",imitator24,tweet
578,"So, you leaving your toenail clippings everywhere is disgusting. Please throw them out. I keep finding them everywhere.",imitator24,tweet
579,What is the deal with you not covering your mouth when you cough or sneeze. I can see spit particles fly and it's gross.,imitator24,tweet
580,Great job on winning the race. Hard work and dedication do pay off! Couldn't be more proud of you! You deserve it.,imitator24,tweet
581,I think after what I've done for this company I deserve a raise. The money I've brought in speaks for itself.,imitator24,tweet
582,Why do you always have to fall asleep with the tv on so loud? I can't hear it in my room. Please try to turn off the TV.,imitator24,tweet
583,"I can't win today. I woke up late, got in an accident, had a terrible presentation at work and to top it off 76ers lost.",imitator24,tweet
584,Mom and Dad thank you so much for your help these past few years. It's been rough & I wouldn't have made it without you.,imitator24,tweet
585,In 5 years I plan on having 2 more kids and probably selling the house we bought to move into a bigger one.,imitator24,tweet
586,I apologize. I had car trouble this morning and had to wait for triple A to come out. I should be in about an hour.,imitator24,tweet
587,"Mom and dad, thank you so much for the christmas gifts. The girls loved them. I wish you could be here with us!",imitator24,tweet
588,"Today sucks. I burnt my breakfast this morning, was late for work, ripped my pants and I think I'm getting sick.",imitator24,tweet
589,Thank you so much for the wedding gift. Only you could not get something on the registry and it be exactly what I need!,imitator24,tweet
590,I apologize. I'm not sure what happened but the meeting never showed up on my calendar! Can we get IT to look into it?,imitator24,tweet
591,I've worked overtime with no extra pay and I've come in early most days too. I deserve a raise for everything I do.,imitator24,tweet
592,If I don't get a raise I'm going to quit. I've been underpaid for far too long and don't see a future here otherwise.,imitator24,tweet
593,Winter is cold but it has the best holidays. You get to go sledding and ice skating and you can always layer1,imitator24,tweet
594,I think in 5 years I'll have started my own real estate business on the side while moving up to COO of my current job.,imitator24,tweet
595,Way to go on your graduation. I'm so proud of you. I can't believe you're don already. You inspire me to do more.,imitator24,tweet
596,I'm sorry. I'm still pulling the documents you requested for the meeting. My computer was having major issues.,imitator24,tweet
