,sample,imitator,type
0,"I have had the absolute worst day. You seriously would not even believe. I woke up late, but not because the kids slept in. They had shut my alarm off!! Then, I found them in the kitchen getting into the peanut butter!!! Ugh! I got the all cleaned up and off to school. Then I remembered I had an appointment this morning, which I'd missed. I had to reschedule. That was all before noon. Seriously, can it get any worse??? Hopefully you're having a much better day than I am!",imitator1,email
1,"I hope to be in nursing school in 5 years. I hope to be close to finally earning my degree. My kids will all be in school. I will be doing great in school, helping my children be the best they can be, and working towards a better life for my family.",imitator1,email
2,"The books you have written go so much further than just books. You have created an environment, an entire world, a whole generation! Your books were amazing when I read them. I imagine them to be even better when I one day share them with my children. I cannot wait to see the magic come alive in my children's eyes.",imitator1,email
3,"Today is a very hectic day. The baby has been up all night vomiting, and I think I may have to take her to the doctor this afternoon. I really don't think I can get away even for a moment with all this going on. If I can't get her to keep some fluids down soon, we may be looking at a visit to the hospital. I am so sorry to have to cancel last minute like this. Let's reschedule for lunch next week, my treat!",imitator1,email
4,"I have considered the future a lot. My husband and I have discussed having another baby within the next few years. If this happens, I see myself about where I am now. I will continue to be a stay at home mom, doing my best to shape these beautiful children into wonderful little people. I hope to continue doing my best by these little humans.",imitator1,email
5,"During days like today, it’s important to know that you’re not alone. Unfortunately, there is no redo or undo button. But, you already knew that. I’m sure someone today told you that these troublesome days only make you stronger. And even though, in the back of your mind you believe them there’s probably a bigger part of you that just wants to self-loathe a bit. Right?\n\nGuess what, snap out of it! Or else your bad day will become bad days, a bad week or snowball into a bad month. There’s no real way to sugar coat it – stuff happens. Bad days are just one of the many elements that are part of life. Instead of honing in on the negative, think of the ways things could be worse and count your blessings.",imitator2,email
6,"Congratulations on the completion of the construction of the new marketing wing of XYZ! I know how much time you put into the plans for the building, and I really appreciate the innovation and attention to detail you brought to the project. We knew you were the right person for the job!\n\nThank you so much for your and your staff’s hard work. We look forward to future projects with you.",imitator2,email
7,"Thank you for pulling me into your imaginary world when I needed escaping from my own. You made my skies bright when my days felt gloomy, and granted me shelter when the world around me felt too bright. You taught me the beauty in semi-colons, the sophistication in stringing unordinary words together, and the importance in believing in what you love.",imitator2,email
8,"You never know where this next year will take you, but why should that stop you. I hope this is a year where you smile a lot, learn a lot, and love a lot. I hope you discover something new and exciting, hold on to what you’ve always loved before, and find something unexpected that will amaze you like nothing else, because honestly those are the best surprises. Just remember to take me with you if you are jumping on that bus, train, or plane to explore, because you’re not getting away from me that easily.",imitator2,email
9,"The only way of finding out why your partner doesn’t want to travel is by talking about travel a lot. Sometimes it may be as simple as the cost, which your partner may find prohibitive. But he or she may never say so in open for fear of being judged.\nThis happens often when you aren’t married. At this stage the financial status is still hidden, often.\nIf you think your partner is worried about the finances, speak to them. Explore travel desires that won’t burn a hole in the pocket. Show your spouse traveling options with discounts and offers on tour packages.\nIf cost is the reason, you both need to discuss it in open. Only then you will have any chance of prevailing over your partner and convincing him or her to go on a holiday. For cheap holiday packages check out Expedia, Thomas Cook, Last Minute, Cox and Kings etc.",imitator2,email
10,I'm sorry that you had a terrible day. Do you want to go out and grab something to eat or I could come over to hang out and you could tell me about it. I hope tomorrow will be better for you. Just think positive. I'm sure that it will get better and the rest of your week will be awesome. Let me know if you want to get together.,imitator3,email
11,"I'm sorry, but I have to tell you that your habit is a bit annoying. Don't get offended, I just wanted to point it out to you. Has anyone else told you about your habit? It's not that it's doing any harm to anyone else or me, I just wanted to address it. Was it okay that I told you? I don't want you to be mad at me though.",imitator3,email
12,"I went to Paris, France and I have to say the culture is like nothing I have seen in the United States. It's so calming there and you can learn just about anything like the food, the architecture of the buildings, the history of the people. It is so amazing. I hope that you will be able to go one day because you would love it.",imitator3,email
13,"Dear Eric Jerome Dickey, I have read many of your books for some years now and I have to say you are one of my favorite authors. When you bring out a new book, I am one of the first to seek it out so I can read it or at least try to find it in the local library. Your books sweep me right into the story. I can't wait for your next book to be published.",imitator3,email
14,"Dear parents, I want to thank you for always being there when I was growing up. Many kids I know may only have one of their parents or neither of the at all, and I know that I was blessed to have you both and still have you both in my life. You were awesome parents and now I understand the things that you were trying to teach me and I see myself teaching my own children in the same respect.",imitator3,email
15,One of the reasons I am going to be late for a meeting today is  because of traffic. there is lots of traffic in the city today that you can barely move.\nAnother reason as to why i am going to be late for the meeting is lack of motivation. the meeting is going is boring and the topic is not of any interest to me. ,imitator4,email
16,"I would like to thank my parents for the love they have shown me throughout my entire life, since i was born. \nI would also like to thank my parents for the education that they have provided for me, i am very grateful for that. \nlastly i would like to thank my parents for believing in me. they made me whoever i am. ",imitator4,email
17,"in five years i want to have my own company. \nin five years i want to own several cars.\nin five years i want to have several homes.\nin five years i want to have a family starting a family is a very hard thing to do, i would like to have had one in five years time. two babies are enough for me i think",imitator4,email
18,"it took me a very long to get dressed, first i couldn't my laundry, then when i found it, it was all wrinkled, so i had to do some ironing. breakfast was a hustle, i checked the fridge and could't find any milk. \ngoing to work i got stuck in traffic for almost an hour, the traffic was so bad! and that is why ",imitator4,email
19,I would like to thank Ben Foster my best friend for the car he bought me. he is a very good friend. \ni would like to thank Ann for the chain she bought me.\nAnn is my best friend and I would really like to appreciate her for being part of my life.\nAnn once bought me a tv set too I love that tv set it represents how colorful and interesting our relationship is.  ,imitator4,email
20,"Dear mom and dad,\n\nI just wanted to thank you for everything you've done. I love you, and you know this, but I don't think you get thanked enough for what you do. I just wanted to let you know, again, that I'm thinking of you and everything you've done for me and if I'm called to repay it I will. I love you.",imitator5,email
21,"Dear Friend,\n\nApologies, but I had to cancel our meet. Something came up at work and I have to sit down and really put my nose to the grindstone for, like, hours. It's not something I want to do and it's gross but it happens, you know. Let's reschedule. There's a good place to drink near my house, maybe 2 people present on a good night. Let's hang. ",imitator5,email
22,"Dear Boss, \n\nI've been working very hard for very long and under pretty nutty conditions. I tolerate it when I'm called in on weekends, outside of work hours, and even when I'm asked to go unpaid. It's fine, I don't have a problem with that. But I have to be paid much more for what I've done and what I'm willing to do. There has to be an immediate renegotiation of salary or my two weeks is in hand.",imitator5,email
23,"Baby Driver has one of the best soundtracks in decades, the way music flows and stops so effortlessly and to support the machinations of the plot, the smooth mixing of Baby's character and anxiety into pop, awkward 50s beats and ragtime and how his cool demeanor is more of a facade than anything. It's so good.",imitator5,email
24,"Congratulations. You worked hard on it, really hard, harder than most, and you deserved it a lot sooner. There's not much else I can say, lol, other than you deserved more faster. But you know that and they know that so your ascendancy to CEO is all over but the crying. It's great stuff, just don't forget me when you're in your premium condo.",imitator5,email
25,I am having such a terrible day today because to start off when i went to get gas before going to work the gas handle did not stop and gas got all over me. I had to rush home to shower and change and then i was late to work and a meeting. this ruined my whole day. ,imitator6,email
26,I am going to be late because this morning when i went to put gas in my car the handle did not stop causing gas to gush out everywhere and get all over me.  I have to rush home and shower and change and ill be on my way to join the meeting.,imitator6,email
27,"Dear Joan Crawford,\n\nI am such a huge fan of yours that i just wanted to tell you that i appreciate all you do and the work that you do. I would like to know more from before you became famous, like your childhood, and up until the point you \",imitator6,email
28,"Honey, i was reading up on this vacation package on a viking cruise. I think it would be really awesome if we could do something like this and see other parts of the world from a beautiful cruise boat.  the prices are not unreasonable and we can afford it. ",imitator6,email
29,I am going to be late to the meeting because last night there as a storm and it knocked my alarm clock out and it did not go off causing me to oversleep.  I am getting ready now to get to this meeting as soon as I can.  I apologize for the inconvenience. ,imitator6,email
30,I need to cancel our plans for this weekend because one of my children is sick and I need to stay at home to take care of them. I feel bad as I was looking forward to this event but it's important for Johnny to recover from this illness.  Could we maybe reschedule for sometime the following weekend?,imitator7,email
31,. I thought that you really captured the essence of the character.  Your performance inspired me to pursue my own career in the performing arts. I really hope that you continue to share your amazing performance skills with us in the future.,imitator7,email
32,I want to congratulate you on achieving your goal.  I know that you worked so hard on this project and you definitely deserve this recognition.   I have been inspired in my own life as a result of the way that you worked every day to accomplish this goal and I'm so proud of the example that you set.,imitator7,email
33,Thank you so much for your thoughtfulness and generosity with this amazing gift. I was so surprised when I opened the package as it was so unexpected.  I know that I will definitely use this gift every day and that I will get a lot of enjoyment out of it.  Thank you so much again for thinking of me!,imitator7,email
34,Thank you for this amazing present.  I am so honored to be your friend and I cherish every day that I get to enjoy your friendship and camaraderie.  This present was such a creative idea and I can't think of anyone else that could have come up with such a cool and innovative idea. Thank you so much!,imitator7,email
35,"Ya know, my favorite season is Winter. I love not being too hot or worry about showing my flab. I mean, don't get me wrong, Spring is nice with all the green and growing stuff, but seriously, Winter is awesome. When else is it ok to curl up and ignore the world? That totally makes me crave a hot chocolate... ",imitator8,email
36,"Hello Sir,\nAfter the extremely positive performance appraisal you discussed with me this past week, I felt I needed to approach you. I have been with the company for 26 months and have performed exemplary the entire time. I am prompt, hard-working, and I use the Oxford comma appropriately. If you could, Sir, consider boosting my salary commiserate to my performance?",imitator8,email
37,"Good going, Girl! I am so proud of you! I is wonderful to hear that you accomplished what you worked so hard to achieve. In the beginning, you were so unsure if you could pull it off, but Girl, you have worked your heart out for this! And you did it! Congratulations, Love, you deserve this. One hundred percent!",imitator8,email
38,"Dear Mom and Dad, I really do appreciate what you've done for me. I know it was a stretch for you and that you had to think incredibly hard about whether or not you'd be able to help me out. I know this. And I am very grateful. Rest assured that I will cherish your warm and caring gesture forever. Thank you. ",imitator8,email
39,"Neil, I know you hear this all the time, but I had to express to you just how much your work means to me. On every level you are an inspiration, a leader, and a mentor, whether you are aware of it or not. Your works are magnificent and awe-inspiring and they have impacted my life in a wonderful way.",imitator8,email
40,"It was amazing, the food was great and so unique. But honestly, their wood fired broolyn style pizza took the cake. It was to die for. Also, the people there were different than down south, but not the rude mean northerner type that you hear about down here from time to time. There was a lot of music and art displayed out on the streets which was really cool.",imitator9,email
41,"Thank you both so much. I really appreciate it, and yall did not have to do that at all. It means so much to me though that you would think of me that way, and go out of your way during your busy days to send me this. It really will go a long way and it means more to me than you know. I love you both and I am so grateful for parents like the both of you.",imitator9,email
42,"The culture there was intriguing. People were dancing in the streets, and it was very diverse. The food even was too. On every corner there were at least 4 completely different types of authentic restaurants. It was a great eye opening experience, and I honestly feel more cultured just from spending a few days there. 10/10 recommend visiting!",imitator9,email
43,"Thank you mom and dad. For everything. But mostly for loving me and caring for me and always providing for my needs. It means more to me than you know, and I know I can never repay for you all you have done, all you do, and all you will do. I only hope that I can do the same for my own children some day.",imitator9,email
44,"I see myself married and graduating from graduate school with my masters degree. I see myself buying a house and possibly moving to a new city for a new job with my husband. I see us having the conversation about having kids of our own and starting a family together. Most importantly, I see myself happy and successful and loved.",imitator9,email
45,"Hi Mom and Dad,\n\nThanks for helping me out with the graphics card. I know it seems like a frivolous expense but for me its an important tool that I am glad that I have access to now. I can't wait to show you the fruits of my labor.\n\nYour son",imitator10,email
46,"To whom it may concern,\n\nRegarding the meeting we have scheduled this Thursday, I just wanted to give a heads up that I will be late a few minutes. I have a doctors appointment scheduled that cannot be moved and will likely be on my way back to the office as the meeting is underway. \n\nMy Apologies",imitator10,email
47,"Dude did I just rewatched Kill Bill 2 and realized I recognized the guy who played Pai Mei. So I do some searching turns out actor, Gordon Liu, was in kung fu movie when he was younger and had to fight against him. Seems like a funny spin on the student becoming the master.",imitator10,email
48,"Dear Mom and Dad,\n\nI appreciate the support you have given me in and the love you've always shown and just wanted to send a humble thanks.\n",imitator10,email
49,"Hey, Sorry but I'm not going to be able to make it out to you guys. I just wanted to give you notice  that I have an obligation to keep up with and won't be free.",imitator10,email
50,I just wanted to bring up an important issue with you. I have been a valuable member of the company for a long period of time and would like to discuss the possibility of a raise with you.  ,imitator11,email
51,Hey. Sorry something very unexpected came up and I have to cancel our plans for now. I hope that we can talk soon and reschedule for a later date.  Talk soon? ,imitator11,email
52,I just wanted to reach out and let you know how much I enjoyed your new book.  The characters were so engaging and by the end I felt like I knew them. I cannot wait to read the next installment.,imitator11,email
53,Hey you. I heard the good news!  I just wanted to say congratulations and tell you that I am so proud of you. Keep up the good work!,imitator11,email
54,I honestly can't predict where the future is going to take me. Right now I feel like I am existing in a state of limbo so I am constantly in fear of what is around the next bend.,imitator11,email
55,"I'm sorry, I won't be able to meet up tonight. I was really looking forward to getting together with you, but unfortunately I just got a call from work and I have to go in and put in an overnight shift, and I couldn't get out of it. We're really slammed at work, so I was kind of afraid this would happen. I hope you have a nice time without me.",imitator12,email
56,"Hello.\n\nI just flew back from Seattle, and am I ever happy to be home. God, I really hate everything about the culture of that city. The smug, condescending, morally superior attitude everybody seems to have, the tolerance for being crammed in such close quarters, the smarmy holier than thou liberalism.",imitator12,email
57,"Dear Mr. Caviezel\n\nHello, I'm writing this message to express how much I appreciated your performance in my favorite television program, Person of Interest. I've been a fan of your work since I first saw you in the film Frequency, and I've enjoyed your film and television appearances ever since. I'm sure you receive a great deal of this sort of fan mail, so I'll keep my message brief. I just wanted to say that I thought your portrayal of Mr. Reese was fantastic, and it really brightened up my day any time the show came on.",imitator12,email
58,"Hey there.\n\nI was hoping you'd be able to schedule your vacation leave for the same time I'm scheduling mine; I'd like to take you on a camping trip to Glacier in July. My vacation is the first two weeks of July, so if you're able to schedule your time off for the same time I think we'd have a great time.",imitator12,email
59,"You really did it. I hate to admit it, but I didn't think you'd be able to pull it off, but you finally made it and you're going to retire. Congratulations. It's always sad to see somebody call it a day, but I hope you find a good project to keep yourself busy with all the free time you're going to have.",imitator12,email
60,"I’m so sorry for the absurdly late notice, but I’m not going to be able to make it tonight. I feel awful for not letting you know before today, but the fact is I’m a bit stressed with an upcoming deadline and I didn’t sleep well last night, so I’d be terrible company. I hope you won’t hold it against me and that we can reschedule (drinks on me!). Let me know if either [date] or [date] works. If neither of those are good for you, please suggest a time, and I’ll do my best to make it happen.",imitator13,email
61,"The only way of finding out why your partner doesn’t want to travel is by talking about travel a lot. Sometimes it may be as simple as the cost, which your partner may find prohibitive. But he or she may never say so in open for fear of being judged.\n\nThis happens often when you aren’t married. At this stage the financial status is still hidden, often.\n\nIf you think your partner is worried about the finances, speak to them. Explore travel desires that won’t burn a hole in the pocket. Show your spouse traveling options with discounts and offers on tour packages.\n\nIf cost is the reason, you both need to discuss it in open. Only then you will have any chance of prevailing over your partner and convincing him or her to go on a holiday. For cheap holiday packages check out Expedia, Thomas Cook, Last Minute, Cox and Kings etc.",imitator13,email
62,"Here’s to another year of adventures. Here’s to watching movies and videos that we will quote for months, to eating ice cream and having 5-hour phone conversations. Here’s to quoting songs and never being afraid to dance along (or have you laugh at me as I dance and sing along). Here’s to the board games that you may beat me at one day, but not today. Here’s to me being clumsy and stubborn and you being slightly less clumsy but just as stubborn. Here’s to playing would you rather and knowing random facts about each other because of it. Here’s to pizza at midnight, pancakes at noon, and cake on birthdays. Here’s to another year of having you as my best friend.",imitator13,email
63,Thank you very much for the tickets to the hockey game. What a generous gift! My thirteen-year-old daughter couldn't believe we got to sit so close to the ice--right behind the team. She was thrilled to see her favorite player in person and I was excited for her. We appreciate your thoughtfulness. Your timing was perfect.,imitator13,email
64,"I have greatly enjoyed working at XYZ Sales Company for the past three years. In those years, I have become an integral member of the sales team, and have developed innovative ways to contribute to the company.\n\nFor example, in the past year alone, I have achieved the following goals:\n\nHighest-ranking salesperson in customer satisfaction last quarter\nBrought two new high-profile clients to the company, increasing total company sales revenue by 10%\nVoluntarily trained incoming sales staff, totaling 80 hours of voluntary service\nI believe I have gone above and beyond the benchmarks we set for my position when I arrived at the company three years ago.",imitator13,email
65,"I would ask but I'm worried about my job at the moment. I'm scared to make waves, maybe I'll just wait. If I do a good job I'm sure he'll offer me one. ",imitator14,tweet
66,"Congratulations man, if anyone deserved it it was you. I remember when you started this journey and told me about your goal.",imitator14,tweet
67,"Hey babe, I was thinking since we both have been working really hard lately we should get away for the weekend, what do you think?",imitator14,tweet
68,Idk if I've ever told you but my all time favorite season is spring. I love the weather getting warmer and the storms. Yay rain,imitator14,tweet
69,"I have always been a huge fan of yours Mark Shepard! It was so cool to get to meet you at PCC last fall, can't wait to meet again.",imitator14,tweet
70,I've been to a lot of cities my friend but I would have to say Metropolis was just amazing! So much Superman just everywhere!,imitator14,tweet
71,"Erest Cline, your book Ready Player One was the best book I have ever read! I've read it 3 times and saw the movie twice!",imitator14,tweet
72,"Congratulations, I know you have been pounding the pavement trying to get that account, and I told you you would. Congrates again!",imitator14,tweet
73,"I've worked with this company for a very long time and I have always been among the top in performance, I would like a raise.",imitator14,tweet
74,In five years I see myself enjoying life at my goal weight and traveling the world with my daughter. Also I want to have steady income ,imitator14,tweet
75,"Dude, you have to go see Ready Player One. It is by far the best movie out there and all the Easter eggs in it is mind boggling.",imitator14,tweet
76,I've held my tongue as long as I can but I just can't handle you making those dumb animal sounds all the time. Please stop,imitator14,tweet
77,I was thinking honey and I think we should get away for a few days. We could both really use a break from normal life and stress.,imitator14,tweet
