,sample,imitator,type
597,"In 5 years I see myself 5 years older than I am now. Oh also, with a new car, new job and new house. ",imitator24,tweet
598,"Mom and dad, thank you so much for all the time you spent helping me get on my feet. I wouldn't be where I am today!",imitator24,tweet
599,"Today is the worst. I'm sick, I'm late, I have a headache and my girlfriend and I had a huge fight this morning.",imitator24,tweet
600,"If you compare the money that I've brought in and how I'm compensated, It's easy to see I'm worth more to the company.",imitator24,tweet
601,In 5 years I hope to have quit my job and start working on my own business. I will have 2 more kids and a new house.,imitator24,tweet
602,"listen, Fall has it all! The leaves change, fall fashion, cooler but not too cold. Oh and did I mention football?",imitator24,tweet
603,Wow. I can't believe you got this for me. It's exactly what I wanted. You know me so well. Thank you!,imitator24,tweet
604,I can't keep driving all the way across town and have you schedule these meeting so close together. I need a new schedule.,imitator24,tweet
605,"Hey, I just got the email for the gift card. Thank you so much! You definitely didn't have to do that but thank you!",imitator24,tweet
606,Dear Bradley Cooper. You are my favorite actor and person. You are a grounded guy in a Hollywood world. Go eagles!,imitator24,tweet
607,In 5 years I hope to have moved on from this nothing town. I'd be living in a high rise apartment in the city.,imitator24,tweet
608,I can't believe how nice they were in Philadelphia. They get such a bad rap but everyone was really helpful.,imitator24,tweet
609,I was thinking this year I have my party at the pier and we shut it down. I think that would be awesome. Thoughts?,imitator24,tweet
610,This movie is the best allegory for what's happening in our society right now. I can't believe you haven't seen it!,imitator24,tweet
611,I can't believe you go this for me. I wasn't expecting this at all. Thank you so much. You're the best!,imitator24,tweet
612,I've been reviewing what other people in my position make and I'm vastly underpaid. I think I deserve a raise.,imitator24,tweet
613,Wow! I'm so happy and prod of you. I always knew you could do it. Keep moving up and proving all the haters wrong!,imitator24,tweet
614,They are so dirty there. It's like no one cares what they look like when the go outside. Never going back.,imitator24,tweet
615,My favorite actor is Adam Sandler because every movie makes me laugh. He is a comedian.,imitator25,text
616,The culture of Seattle is unique. You will find people from every races and backgrounds.,imitator25,text
617,"Im so sorry I have to cancel. My car is leaking oil very badly, I don't want to hurt it. ",imitator25,text
618,Footloose. Because I love fun energetic movies with lots of upbeat music and smiles. ,imitator25,text
619,Thank you so much for my birthday gift this year. I can use it all the time. Very handy!,imitator25,text
620,Seattle is a unique city. You will find people from every race and background. ,imitator25,text
621,Seattle is very unique. You can find food from every culture in the world in one city. ,imitator25,text
622,This year I want a new plate set for my kitchen. My old one is very worn out. ,imitator25,text
623,Congratulations!You did so good. I knew you could do it if you stuck to it! Proud of you!,imitator25,text
624,I was just wondering if maybe i could get a promotion. I work and achieve the most!,imitator25,text
625,I just wanted you to know you are my favorite of all time. You made my childhood great!,imitator25,text
626,I see myself settled into my own house on a little piece of land with my wife!,imitator25,text
627,Summer is so beautiful. It brings families together and is the season of good outdoor fun!,imitator25,text
628,Thank you for the gift you had given me. You guys always know exactly what I want. ,imitator25,text
629,"I see myself in a very stable career. With my wife, in our own house very happy!",imitator25,text
630,"You have always been my favorite because even during sad movies, you still make it fun!",imitator25,text
631,I am not going to be on time. My car would not start this morning. I tried everything. ,imitator25,text
632,Could I get a raise. I always go above and beyond what everyone else does. ,imitator25,text
633,Very different. It was like everything in the world was smashed into one area,imitator25,text
634,Thank you! ever since we were little you knew exactly what I want! You are the best. ,imitator25,text
635,I have to cancel tonight. My dog is very sick and I need to be there for him.,imitator25,text
636,Im so sorry I have to cancel. I have to wait until the plumber comes over to fix a pipe. ,imitator25,text
637,I really dont like when you chew with your mouth open. Especially in public. ,imitator25,text
638,"Summer is the best. It is the season of family, late hot nights and cook outs. ",imitator25,text
639,I would go to hawaii. Nothing better than a tropical paradise with the love of your life. ,imitator25,text
640,I think i need a raise. I dont think my time and effort is being paid right. ,imitator25,text
641,I have to cancel tonight because my work called and they need me to come back in ,imitator25,text
642,he is always smiling and happy. I wish more people could be like this today,imitator25,text
643,Its fun and very upbeat. Its family friendly and easy for everyone in the family ,imitator25,text
644,May I have a raise. I have been here forever and my pay has never changed. ,imitator25,text
645,Everything possible has gone wrong today. Nothing has gone right. NOTHING!,imitator25,text
646,I have a flat tire. I have to wait for the tire specialist to get here first. ,imitator25,text
647,Thank you again. You know how to make me smile every single year. You the best!,imitator25,text
648,Go somewhere warm and romantic. Somewhere that is not over populated and loud. ,imitator25,text
649,Im sorry. My car battery was dead. It set me behind twenty minutes this morning. ,imitator25,text
650,Im sorry i have to cancel. My parents called and they need help tonight ,imitator25,text
651,Very charming and cute. Best part of all this person has a huge personality. ,imitator25,text
652,Good job. I always believed in you and knew that you could do it. never give up ,imitator25,text
653,Thank you for always making me laugh through out all of these years. I love that!,imitator25,text
654,Could i get a pay jump. I work extra hours and need more money to support family ,imitator25,text
655,Thank you for always being there for me and always seizing to amaze me with gifts. ,imitator25,text
656,Congratulations. This proves if you never give up that you can succeed anything!,imitator25,text
657,I have to cancel tonight. My cat is sick and im scared to leave her alone ,imitator25,text
658,Very sarcastic yet serious. You know how to hit all types of your viewers in all films ,imitator25,text
659,It will have you tapping your feet along to the whole thing. Best movie,imitator25,text
660,I feel like i was in a whole different world. It was so different than anything else,imitator25,text
661,Good job. Keep up the hard work and keep succeeding at life. You are doing great ,imitator25,text
662,Thank you for the birthday card you sent me. You put a smile on my face and my day,imitator25,text
663,I need more money to support my family in these hard times. Its just not enough,imitator25,text
664,I want a new set of tires for my car. They are starting to get really bare. ,imitator25,text
665,Could we discuss my salary soon?  It's been over a year now.  I am interested in advancing.,imitator26,text
666,Congrats Sara!  Your new home is lovely and I think you guys will be very happy in the neighborhood!,imitator26,text
667,"Mr. King, it would sure be great if you came out with an original work in time for Christmas!",imitator26,text
668,Thanks Eve for the wonderful gift!  I will treasure the thought as well as enjoy the present!,imitator26,text
669,I would be interested in setting aside a time when we could discuss the possibility of a raise in my salary.,imitator26,text
670,I have a dentist appointment tomorrow and will be a bit late for the meeting.,imitator26,text
671,Did you enjoy Kitchen Stories?  I really love the guy in the big chair!,imitator26,text
672,Thank you for the lovely card!  It means so much to hear from you on our special day!,imitator26,text
673,In five years I expect to have the house paid for and be ready to start some major improvements!,imitator26,text
674,Did you like the part where he was spying on the spy?  That was so funny....,imitator26,text
675,"Dear Mr. King, I really enjoy your collarorations with your son, but hope for a solo novel soon!",imitator26,text
676,"Seattle was very strange to me, I am not used to West Coast culture at all!",imitator26,text
677,I have to cancel my plans to meet tonight as I am going to have to work late.  Can we do it next week?,imitator26,text
678,Seattle's gum wall is so weird!  And oddly appealing.  We took a snap and will send.,imitator26,text
679,"Seattle has some great restaurants, but everything is a bit pricey.  I had more fun in the mountains.",imitator26,text
680,Seattle has a lot of tech workers and it seems to be a fairly wealthy area.  Interesting!,imitator26,text
681,"Today has been the worst!  Had a headache and it never got better, can't wait for bed!",imitator26,text
682,"Well, my boss yelled at me for something that wasn't my fault and I had to bite my tongue hard!  Tomorrow is another day though",imitator26,text
683,Thank you for stopping by last night.  It was great to see you and hope to do it again very soon!,imitator26,text
684,"I know it's hard not to smoke indoors, but it is only polite to those who hate the smell, I'll go outside with you next time.",imitator26,text
685,"Hey, lets go to Florida next winter!  Be so nice to get away from the cold for a bit and swim in the ocean!",imitator26,text
686,"I'm going to have to cancel our dinner, my brother is ill and needs help to the doctors.  Can we do it tomorrow?",imitator26,text
687,How about Maine?  It's be great to go to Bar Harbor and see the wild ocean!,imitator26,text
688,"Your habit of snapping your gum is so distracting!  I'm sorry to mention it, but it is hurting my productivity",imitator26,text
689,I love spring!  It would be nice if it would actually arrive this year!,imitator26,text
690,"Oh, I would love to go out to eat, thanks for asking!  That would be fun!",imitator26,text
691,"Seattle was a busy city, always something going on.  Almost too much to do.",imitator26,text
692,"I really liked the ending, I hope you enjoy it also.  Quite moving and memorable.",imitator26,text
693,Thanks for the great gift!  I'll think of you every time I listen! Thanks again.,imitator26,text
694,I really like the characters.  It's so neat that rural farmers are portrayed as being very intelligent and worldly,imitator26,text
695,I have to pick up my son from school before the meeting and will be running about 10 minutes late.,imitator26,text
696,Today has been awful!  Got out of the wrong side of bed and just couldn't get going.,imitator26,text
697,"I'm not going to be able to make it tonight, something urgent came up.  Will be there next week though.",imitator26,text
698,"I love spring, it's so nice to get back outside and begin a garden.  Love the nice weather.",imitator26,text
699,"It's a great film.  Too bad you have to read subtitles, but well worth the effort.",imitator26,text
700,"Mr. King, it would be great if you would work on a solo novel again, perhaps a sequel to Dune?",imitator26,text
701,"My favorite movie of all time is Kitchen Stories.  It's available at the library, you should check it out!",imitator26,text
702,I would love some new lotion.  Surprise me with a scent!  It will be fun!,imitator26,text
703,My day has been the pits.  Got a parking ticket and was late for a meeting.  Looking forward to some wine!,imitator26,text
704,"Dear Mr. King, please give us a new work for Christmas!  Look forward to it every year!",imitator26,text
705,Spring is the best!  The whole world relaxes and celebrates the season!,imitator26,text
706,It's so sad when he learns that he doesn't get a real horse.  I really felt for him.,imitator26,text
707,Seattle doesn't have the rule that you have to have public restrooms if you are a business.  Nasty!,imitator26,text
708,Seattle is very difficult to drive in with all the steep roads.  Not fun!,imitator26,text
709,"Mr. King, loved Misery, more like this please!  Your biggest fan......lol",imitator26,text
710,Could we go to Dallas?  Never been there and heard so much about it!  What say you?,imitator26,text
711,"Thanks for having us over, the meal was wonderful and the company the best!",imitator26,text
712,I see myself getting a promotion or two before then.  Will have more income!,imitator26,text
713,Spring is awesome!  Can't wait to go to the park with you guys again!  Soon soon!,imitator26,text
714,Could we get together to discuss my salary?  I would like to increase my pay.,imitator26,text
715,I have a flat tire my insurance roadside assistance is on the line taking forever to get a tow truck to get here.,imitator27,text
716,I see myself with a rentable home with a steady job and less grumpy towards people most days.,imitator27,text
717,"This morning I woke up 2 hours late, the power had went out my alarm didn't go off.  I'm on a final warning from work and my transmission is about to go out in the car.",imitator27,text
718,I've tried to ignore it but I can't anymore.  I can't stand it when you chew with your mouth half open and I can hear you chomping your food.,imitator27,text
719,"We went to this city, it was strange, women couldn't wear jeans n tshirts it had to be dresses and caps.",imitator27,text
720,I got to cancel because I twisted my ankle it's pretty swollen and the Dr. is running an ex-ray.,imitator27,text
721,I will be late because I went out for lunch and ended up in a mild car accident so I'm late for the meeting.  Sorry folks. Lets get started.,imitator27,text
722,"Summer is the best, then we can go fishing and not have to worry about shoveling snow for a few months.",imitator27,text
723,"Honey,? it would be really nice if we could go to Egypt this year I've asked for the last 30 years.",imitator27,text
724,"I got an eviction notice this morning as I was leaving for work.  It's been a horrible day.  Then the daycare called, the kids have lice.",imitator27,text
725,"Hey, my birthday is coming up, it would be nice if I got that pretty necklace we seen yesterday.",imitator27,text
726,"Sorry I'm late, there was a huge traffic jam I didn't hear about because a truck rolled over and traffic was backed up 2 miles.",imitator27,text
727,"Angel it's summer, our favorite season, now we can have our normal contest for the tan foot tribe!",imitator27,text
728,"Ann, you have to see this movie called 12 Strong, it's about the last war we had the Desert Storm.  I know you would like it.  It has horses in it and I know you love horses.",imitator27,text
729,"Dee, I need a new set of tires, my birthday is coming up and I'm barely getting by.  My tires are bald, I got a ticket.",imitator27,text
730,"Summer is the best, get to stay warm without cranking the heat and piling on all the blankets don't you think Ann?",imitator27,text
731,I hear Egypt is really nice this time of year plus we can get out of the cold weather for a time don't you think honey?,imitator27,text
732,"Deb, I love summer, I get to sit in the sun and stay warm, I get to go fishing soon as I get my license.",imitator27,text
733,"Deb today was bad, I woke up late, my car wouldn't start and I twisted my wrist on the lawn mower. ",imitator27,text
734,V.C. Andrews is my favorite author of Flowers in the Attic.  I read all of the series and not long ago there was another book I didn't know about.,imitator27,text
735,"Cornell, this year for my birthday I want a new microwave, mine is about to die.  I've had it for 10 years.",imitator27,text
736,"Ma, Pa, thank you for taking me in when my real mom and dad could not take care of me anymore due to health reasons.",imitator27,text
737,"I lost track of time, I'm running behind for my meeting and now the elevator is stalled and I'm stuck.",imitator27,text
738,I have to cancel because our babysitter canceled on me and I can't get anybody else at this short of a notice.,imitator27,text
739,Thank you ma and pa for the carpool you helped out with to the band practice yesterday afternoon before the game.,imitator27,text
740,"Boss, I've been here 15 years, I never missed a day, I've always been on time.  I need a raise please.",imitator27,text
741,"Mr. Andrews, I love your books, I get so caught up in them I end up reading the whole thing in 1 night.",imitator27,text
742,Ann you would like the greatest musician it's my favorite. it's a musical and about the circus.,imitator27,text
743,"V.C.Andrews is a great author, the stories seem so real you can't put the book down until the end.",imitator27,text
744,"Richard Gere is a good actor, he has that stern steady sharp look. Hes got the eyes that can shoot daggers.",imitator27,text
745,"I've been working over time all week and today it's just been a bad day overall with the kids sick, the car broke down, the husband is cheating.",imitator27,text
746,Thank you so much for the tires Dee I really appreciate them and it means a lot to me. Your the best.,imitator27,text
747,"Ann, the singing and performances they do in the greatest magician is so awesome i had a silly grin the whole movie",imitator27,text
748,"In 5 years, I'll be in a big house with a garage with a good job and no more worries because I won the lottery.",imitator27,text
749,I won the lottery so in 5 years I will have been to Egypt and Australia and Africa. Its gonna be fun,imitator27,text
750,"I need a raise please or I will need to find another job, so a raise or consider this my two week notice.",imitator27,text
751,Can we please consider going to Egypt this time? We have been to every place you want to go.,imitator27,text
752,Thank you parents for raising me the best you could in the short time you had.  I'll never forget.,imitator27,text
753,I'm going to be late for my meeting because my dog ran out in front of a car and I need to take her to the vet.,imitator27,text
754,Ann Pitch Perfect is a grand movie the singing is very creative you would really like it i'm sure,imitator27,text
755,thank you parents for protecting me and taking me to church on sundays when i was a child.,imitator27,text
756,I need to cancel because I have a report that needs to be done for work or I will loose my job.,imitator27,text
757,"Summer is the best season Deb, Get to go for walks and not worry about freezing temperatures.",imitator27,text
758,"12 Strong is an awsome movie Cornell, It's about the war you were in the Desert Storm.  Do you remember if it's accurate?",imitator27,text
759,"Kate and Leapold Is an awesome drama movie I'm sure you will like Ann, It has to do with time travel.",imitator27,text
760,Im going to be late because I am trying to finish this other project that I am working on.,imitator27,text
761,"This day is terrible, I got the car stuck in a huge snow bank and the tow truck pulled my bumper off.",imitator27,text
762,"I want new shoes and new jeans and a new shirt for my birthday, pretty much a new outfit please.",imitator27,text
763,"I want a new tv and can opener for my birthday, my can opener is about shot and my tv is just old.",imitator27,text
764,Good Job you finally finished that table you were hand crafting! It's beautiful I might buy it.,imitator27,text
765,The Joker's character in Batman: Dark Knight Rises was incredible and enjoyable to watch,imitator28,text
766,I sincerely congratulate you on this achievement and wish all best in future endeavors,imitator28,text
767,I want you to buy cheesecake with strawberries on top of it. They are very delicious,imitator28,text
768,My manager is constantly micromanaging me and I am finding hard to concentrate on my job,imitator28,text
769,I am very grateful for your interest and care in me. I hope i will repay in near future,imitator28,text
770,The latest avengers movie is casting every Marvel hero and it will be fantastic,imitator28,text
771,Let's go to Universal Studios. My friends had been there and praised it. Seems wonderful,imitator28,text
772,I see myself having married and with kids. Having gotten my mortgage and stable income,imitator28,text
773,I missed my scheduled bus and had to wait for additional 30 minutes on the station,imitator28,text
774,I dropped my phone on the ground and now there is a crack on the screen,imitator28,text
775,I think I have done good so far and per your agreement I would like to have a raise,imitator28,text
776,The black panther was very motivating to watch and shows one can overcome difficulties,imitator28,text
777,"Enjoy it dude, it is your time and many congratulations on this success of yours",imitator28,text
778,Why don't we go to beach. It is a nice weather and we could enjoy some time under the sun,imitator28,text
779,Me and Karen enjoyed Rampage last night at movie theater. Dwayne Johnson was magnificent,imitator28,text
780,I wish I could have repaid you right now for all these kindness. You mean everything to me,imitator28,text
781,"Due to work related circumstances, i had to cancel my planned plans. It feels bit annoying",imitator28,text
782,I would like to take you to a new Chinese restaurant opened last week in our neighborhood.,imitator28,text
783,It means a lot to me. Thank you very much for consideration and for this great gift,imitator28,text
784,I want a portray of me printed with very bright colors and natural background behind it,imitator28,text
785,I will be travelling the world and seeing so many different cultures and traditions,imitator28,text
786,La La Land with its musical performance was mesmerizing. Definitely recommend you to watch,imitator28,text
787,This is very kind of you. I truly appreciate your fastidious care shown toward me and wife,imitator28,text
788,I want a soccer ball. I will invite you all to play with it every weekend afterward,imitator28,text
789,Why are you doing chewing so loudly. It is annoying and disgusting to other here,imitator28,text
790,The Exodus where Christian Bale played was absolutely fantastic and historical,imitator28,text
791,My sincere gratitudes for your kindness and please be advised i will never forget it,imitator28,text
792,It means a lot to me and your grandchildren. Hope they will grow up and realize all these,imitator28,text
793,You are the best dude. You definitely know how to impress me with these things,imitator28,text
794,It is spring break. Let's go to Vail Colorado. It is great ski resort. Would be enjoyable,imitator28,text
795,I was caught under the rain and had no umbrella. I got soaked all wet and was angry,imitator28,text
796,I did not enjoy the spider-man last night. It looked very naive and simple to watch,imitator28,text
797,I am thinking of going to new york. There are great places to visit. What do you think,imitator28,text
798,"Let's go to Miami, Florida. My friends enjoyed their stay last summer. Would be great",imitator28,text
799,There is a great place in downtown for Middle Eastern cuisine. Why not go there,imitator28,text
800,Stop gossiping about your co-workers. It is not a good characteristic of yours,imitator28,text
801,Stop spitting on the streets. It is very disgusting and repulsive to others,imitator28,text
802,I am thinking of getting mortgage and wanted to know if you approve a raise on my salary,imitator28,text
803,This is truly huge Mike. Hope you are enjoying it and accept my best wishes,imitator28,text
804,Stop littering in your neighborhood. The management may charge you a significant amout,imitator28,text
805,i am stuck in traffic and there seems to a long line forming. Don't know when will be free,imitator28,text
806,I had to concede to my partner and was forced to cancel my already planned tasks,imitator28,text
807,It is one of the best moments in your life. I wish you all the best in future,imitator28,text
808,I have lost my keys to my car. Taking bus would take longer and i will be late likely,imitator28,text
809,The weather got really bad suddenly and I was forced not to go camping as I was planning,imitator28,text
810,I have been in this for long-time and completed my every duty and would like to have raise,imitator28,text
811,"It is incredible from your side to give it to me. Thank you from my heart, means a lot",imitator28,text
812,Your play was truly mesmerizing and captivating in its nature. Thank you for experience,imitator28,text
813,I am stuck in work and cannot leave on time as there is unexpected to complete,imitator28,text
814,I got a flat tire in middle of the road while commuting to work. It is terrible to be here,imitator28,text
815,"Ever since I saw you act in that movie, you have been my idol. I wish I could meet you.",imitator29,text
816,"I can't go out tonight, because I have to babysit my neighbor's children and dog.",imitator29,text
817,Whenever you pick at your nails it sends a horrible shiver down my spine. Please stop.,imitator29,text
818,We should go on a trip somewhere soon. Somewhere secluded and romantic. It will be fun! ,imitator29,text
819,"Please don't talk to meet like that, it really irritates me. I am not your brother.",imitator29,text
820,I got stuck on the platform of the train because the trains were backed up. Be there soon!,imitator29,text
821,They have such a vibrant culture. Such great street art and music. And the food! So good.,imitator29,text
822,Thanks mom and dad for sending me a check for my birthday. I will buy some nice clothes!,imitator29,text
823,"Fall is my favorite season. I love seeing the leaves change, wearing scarves and walking.",imitator29,text
